<?xml version="1.0" encoding="UTF-8"?>
<!-- edited with XMLSpy v2007 (http://www.altova.com) by Marcel Kessler (seco) -->
<xs:schema xmlns:xs="http://www.w3.org/2001/XMLSchema" elementFormDefault="qualified" attributeFormDefault="unqualified">
	<xs:complexType name="avggstelle">
		<xs:sequence>
			<xs:element name="Id">
				<xs:simpleType>
					<xs:restriction base="xs:string">
						<xs:maxLength value="12"/>
					</xs:restriction>
				</xs:simpleType>
			</xs:element>
			<xs:element name="Strasse" minOccurs="0">
				<xs:simpleType>
					<xs:restriction base="xs:string">
						<xs:maxLength value="100"/>
					</xs:restriction>
				</xs:simpleType>
			</xs:element>
			<xs:element name="PLZ" minOccurs="0">
				<xs:simpleType>
					<xs:restriction base="xs:string">
						<xs:maxLength value="4"/>
					</xs:restriction>
				</xs:simpleType>
			</xs:element>
			<xs:element name="Ort" minOccurs="0">
				<xs:simpleType>
					<xs:restriction base="xs:string">
						<xs:maxLength value="50"/>
					</xs:restriction>
				</xs:simpleType>
			</xs:element>
			<xs:element name="Telefonnummer" minOccurs="0">
				<xs:simpleType>
					<xs:restriction base="xs:string">
						<xs:maxLength value="20"/>
					</xs:restriction>
				</xs:simpleType>
			</xs:element>
			<xs:element name="Email" minOccurs="0">
				<xs:simpleType>
					<xs:restriction base="xs:string">
						<xs:maxLength value="50"/>
					</xs:restriction>
				</xs:simpleType>
			</xs:element>
		</xs:sequence>
	</xs:complexType>
	<xs:complexType name="avgleiter">
		<xs:sequence>
			<xs:element name="Name">
				<xs:simpleType>
					<xs:restriction base="xs:string">
						<xs:maxLength value="50"/>
					</xs:restriction>
				</xs:simpleType>
			</xs:element>
			<xs:element name="Vorname">
				<xs:simpleType>
					<xs:restriction base="xs:string">
						<xs:maxLength value="50"/>
					</xs:restriction>
				</xs:simpleType>
			</xs:element>
		</xs:sequence>
	</xs:complexType>
	<xs:element name="avg">
		<xs:annotation>
			<xs:documentation>avg betriebe</xs:documentation>
		</xs:annotation>
		<xs:complexType>
			<xs:sequence>
				<xs:element name="Betrieb" type="avgbetrieb" maxOccurs="unbounded"/>
			</xs:sequence>
		</xs:complexType>
	</xs:element>
	<xs:complexType name="avgbetrieb">
		<xs:sequence>
			<xs:element name="Id">
				<xs:simpleType>
					<xs:restriction base="xs:string">
						<xs:maxLength value="12"/>
					</xs:restriction>
				</xs:simpleType>
			</xs:element>
			<xs:element name="Bezeichnung">
				<xs:simpleType>
					<xs:restriction base="xs:string">
						<xs:maxLength value="150"/>
					</xs:restriction>
				</xs:simpleType>
			</xs:element>
			<xs:element name="Strasse" minOccurs="0">
				<xs:simpleType>
					<xs:restriction base="xs:string">
						<xs:maxLength value="100"/>
					</xs:restriction>
				</xs:simpleType>
			</xs:element>
			<xs:element name="PLZ">
				<xs:simpleType>
					<xs:restriction base="xs:string">
						<xs:maxLength value="4"/>
					</xs:restriction>
				</xs:simpleType>
			</xs:element>
			<xs:element name="Ort">
				<xs:simpleType>
					<xs:restriction base="xs:string">
						<xs:maxLength value="50"/>
					</xs:restriction>
				</xs:simpleType>
			</xs:element>
			<xs:element name="Telefonnummer" minOccurs="0">
				<xs:simpleType>
					<xs:restriction base="xs:string">
						<xs:maxLength value="20"/>
					</xs:restriction>
				</xs:simpleType>
			</xs:element>
			<xs:element name="Email" minOccurs="0">
				<xs:simpleType>
					<xs:restriction base="xs:string">
						<xs:maxLength value="50"/>
					</xs:restriction>
				</xs:simpleType>
			</xs:element>
			<xs:element name="GStelle" type="avggstelle" minOccurs="0" maxOccurs="unbounded"/>
			<xs:element name="Leiter" type="avgleiter" minOccurs="0" maxOccurs="unbounded"/>
		</xs:sequence>
	</xs:complexType>
</xs:schema>
